variable,descripcion,grupo,weight
PHOG_IND,Población en hogares censales indígenas,Integrantes del hogar,pobtot
PCON_DISC,Personas con discapacidad,Integrantes del hogar,pobtot
P15PRI_IN,Población con primaria incompleta,Económico,p_15ymas
P15YM_SE,Personas de 15 a 130 años de edad que no aprobaron ningún grado de escolaridad,Económico,p_15ymas
PDESOCUP,Personas que no tenían trabajo,Económico,P_12YMAS
PSINDER,Personas sin derechohabiencia a servicios de salud,Integrantes del hogar,pobtot
PHOGJEF_F,Hogares en viviendas particulares habitadas donde la persona de referencia es mujer.,Hogar,tothog
VPH_PISOTI,Viviendas particulares con piso de tierra,Hogar,TVIVPARHAB
VPH_SINTIC,Viviendas particulares habitadas que no disponen de las tecnologías de la información y de la comunicación,Hogar,TVIVPARHAB